{
  "report_version": "2.0",
  "generated_at": "2026-03-30T12:23:56.436607+00:00",
  "incident_question": "checkout failure spike",
  "rca_source": "graph-rag-llm",
  "rca_result": {
    "status": "ok",
    "root_cause": "emailservice",
    "confidence": 0.6,
    "candidate_roots": [
      {
        "service": "emailservice",
        "rank": 1,
        "evidence_strength": "low",
        "evidence": []
      },
      {
        "service": "cartservice",
        "rank": 2,
        "evidence_strength": "high",
        "evidence": [
          "retrieval_seed=true",
          "depended_by_seed=1"
        ]
      },
      {
        "service": "checkoutservice",
        "rank": 3,
        "evidence_strength": "low",
        "evidence": []
      }
    ],
    "reasoning": "Root cause is prioritized as emailservice from graph-retrieval ranking (cross-signal consistency). Primary observed incident evidence: High number of errors in checkoutservice logs ('rpc error: code = Unavailable desc = connection error: desc = \\\"transport: Error while dialing: dial tcp 10.110.206.0:8080: connect: connection refused\\\"')",
    "impacted_services": [
      "checkoutservice",
      "cartservice",
      "emailservice"
    ],
    "evidence": [
      "High number of errors in checkoutservice logs ('rpc error: code = Unavailable desc = connection error: desc = \\\"transport: Error while dialing: dial tcp 10.110.206.0:8080: connect: connection refused\\\"')",
      "emailservice marked as unhealthy (runtime_unhealthy=true, ready<1)",
      "Dependency path: checkoutservice depends on cartservice and emailservice"
    ],
    "anomalies": [
      {
        "service": "checkoutservice",
        "type": "other",
        "value": 0.0,
        "threshold": 0.0,
        "source": "telemetry"
      },
      {
        "service": "emailservice",
        "type": "other",
        "value": 0.0,
        "threshold": 0.0,
        "source": "telemetry"
      }
    ],
    "suggested_actions": [
      "kubectl get deployment emailservice -n default -o wide",
      "kubectl describe deployment emailservice -n default",
      "kubectl logs deployment/emailservice -n default --tail=200",
      "kubectl get pods -n default"
    ]
  },
  "llm_raw_output": "status=ok\nroot_cause=emailservice\nconfidence=0.6\nimpacted_services=checkoutservice, cartservice, emailservice\nevidence:\n- High number of errors in checkoutservice logs ('rpc error: code = Unavailable desc = connection error: desc = \\\"transport: Error while dialing: dial tcp 10.110.206.0:8080: connect: connection refused\\\"')\n- emailservice marked as unhealthy (runtime_unhealthy=true, ready<1)\n- Dependency path: checkoutservice depends on cartservice and emailservice\nsuggested_actions:\n- kubectl get deployment emailservice -n default -o wide\n- kubectl describe deployment emailservice -n default\n- kubectl logs deployment/emailservice -n default --tail=200",
  "audit": {
    "run_id": "4f01565d-c923-491e-b34d-cef9c4af4ccf",
    "model": "gemma3:12b",
    "embedding_model": "sentence-transformers/all-MiniLM-L6-v2",
    "prompt_version": "rca-graph-rag-v1",
    "context_counts": {
      "total_rows": 500,
      "metrics": 0,
      "logs": 500,
      "telemetry_errors": 0
    },
    "rag_quality": {
      "hit_count": 8,
      "has_hits": true,
      "has_signal_diversity": true,
      "has_source_type_diversity": true,
      "covered_service_count": 3
    },
    "graph_summary": {
      "node_count": 12,
      "seed_services": [
        "cartservice",
        "checkoutservice",
        "currencyservice"
      ],
      "candidate_roots": [
        {
          "service": "emailservice",
          "rank": 1,
          "evidence_strength": "high",
          "evidence": [
            "runtime_unhealthy=true",
            "ready<1",
            "depended_by_seed=1"
          ]
        },
        {
          "service": "cartservice",
          "rank": 2,
          "evidence_strength": "high",
          "evidence": [
            "retrieval_seed=true",
            "depended_by_seed=1",
            "log_signature_match=1"
          ]
        },
        {
          "service": "frontend",
          "rank": 3,
          "evidence_strength": "high",
          "evidence": [
            "log_error_count=478",
            "log_signature_match=1",
            "symptom_service_penalty"
          ]
        }
      ],
      "causal_paths": [
        {
          "from": "checkoutservice",
          "to": "cartservice",
          "relation": "depends_on"
        },
        {
          "from": "checkoutservice",
          "to": "emailservice",
          "relation": "depends_on"
        }
      ]
    },
    "retrieval_summary": {
      "query": "incident_question: checkout failure spike\nruntime_signals: - frontend: error_count=478; samples={\"log\":\"{\\\"error\\\":\\\"rpc error: code = Unavailable desc = connection error: desc = \\\\\\\"transport: Error while dialing: dial tcp 10.110.206.0:8080: connect: connection refused\\\\\\\"\\\",\\\"http.req.id\\\":\\\"873195d4-f2df-4f43-8517-3165364044f2\\\",\\\"http.req.method\\\":\\\"GET\\\",\\\"http.req.path\\\":\\\"/cart\\\",\\\"message\\\":\\\"failed to get product recommendations\\\",\\\"session\\\":\\\"c7b459d5-6878-400a-82f4-1fa521ee2750\\\",\\\"severity\\\":\\\"warn... | {\"log\":\"{\\\"error\\\":\\\"rpc error: code = Unavailable desc = connection error: desc = \\\\\\\"transport: Error while dialing: dial tcp 10.110.206.0:8080: connect: connection refused\\\\\\\"\\\",\\\"http.req.id\\\":\\\"6e4f3813-8a28-4c5e-bcd4-62bb4750c9bb\\\",\\\"http.req.method\\\":\\\"GET\\\",\\\"http.req.path\\\":\\\"/product/66VCHSJNUP\\\",\\\"message\\\":\\\"failed to get product recommendations\\\",\\\"session\\\":\\\"c7b459d5-6878-400a-82f4-1fa521ee2750\\\",\\\"sev... | {\"log\":\"{\\\"error\\\":\\\"rpc error: code = Unavailable desc = connection error: desc = \\\\\\\"transport: Error while dialing: dial tcp 10.110.206.0:8080: connect: connection refused\\\\\\\"\\\",\\\"http.req.id\\\":\\\"5a8ef519-a087-4a21-bc7b-fce00fc17888\\\",\\\"http.req.method\\\":\\\"GET\\\",\\\"http.req.path\\\":\\\"/cart\\\",\\\"message\\\":\\\"failed to get product recommendations\\\",\\\"session\\\":\\\"34595602-d209-409f-a2f3-21dbebd580db\\\",\\\"severity\\\":\\\"warn... ; - checkoutservice: error_count=22; samples={\"log\":\"{\\\"message\\\":\\\"failed to send orde...\ntask: find root cause candidates, dependency impact, and operational evidence",
      "queries": {
        "main": "incident_question: checkout failure spike\nruntime_signals: - frontend: error_count=478; samples={\"log\":\"{\\\"error\\\":\\\"rpc error: code = Unavailable desc = connection error: desc = \\\\\\\"transport: Error while dialing: dial tcp 10.110.206.0:8080: connect: connection refused\\\\\\\"\\\",\\\"http.req.id\\\":\\\"873195d4-f2df-4f43-8517-3165364044f2\\\",\\\"http.req.method\\\":\\\"GET\\\",\\\"http.req.path\\\":\\\"/cart\\\",\\\"message\\\":\\\"failed to get product recommendations\\\",\\\"session\\\":\\\"c7b459d5-6878-400a-82f4-1fa521ee2750\\\",\\\"severity\\\":\\\"warn... | {\"log\":\"{\\\"error\\\":\\\"rpc error: code = Unavailable desc = connection error: desc = \\\\\\\"transport: Error while dialing: dial tcp 10.110.206.0:8080: connect: connection refused\\\\\\\"\\\",\\\"http.req.id\\\":\\\"6e4f3813-8a28-4c5e-bcd4-62bb4750c9bb\\\",\\\"http.req.method\\\":\\\"GET\\\",\\\"http.req.path\\\":\\\"/product/66VCHSJNUP\\\",\\\"message\\\":\\\"failed to get product recommendations\\\",\\\"session\\\":\\\"c7b459d5-6878-400a-82f4-1fa521ee2750\\\",\\\"sev... | {\"log\":\"{\\\"error\\\":\\\"rpc error: code = Unavailable desc = connection error: desc = \\\\\\\"transport: Error while dialing: dial tcp 10.110.206.0:8080: connect: connection refused\\\\\\\"\\\",\\\"http.req.id\\\":\\\"5a8ef519-a087-4a21-bc7b-fce00fc17888\\\",\\\"http.req.method\\\":\\\"GET\\\",\\\"http.req.path\\\":\\\"/cart\\\",\\\"message\\\":\\\"failed to get product recommendations\\\",\\\"session\\\":\\\"34595602-d209-409f-a2f3-21dbebd580db\\\",\\\"severity\\\":\\\"warn... ; - checkoutservice: error_count=22; samples={\"log\":\"{\\\"message\\\":\\\"failed to send orde...\ntask: find root cause candidates, dependency impact, and operational evidence",
        "cmdb": "incident_question: checkout failure spike\nfocus: service dependencies and blast radius from cmdb\ntask: map impacted services and upstream/downstream relation",
        "runtime": "incident_question: checkout failure spike\nfocus: kubernetes runtime status, crashloop, unhealthy deployment\ntask: find operational runtime evidence"
      },
      "top_k": 8,
      "hit_count": 8,
      "sources": [
        "/home/nghia/DACN/aiops_data/telemetry/telemetry_snapshot.jsonl",
        "/home/nghia/DACN/aiops_platform/cmdb/services.json",
        "runtime://default/deployment/checkoutservice"
      ],
      "source_type_counts": {
        "cmdb": 1,
        "runtime": 1,
        "telemetry": 6
      },
      "signal_type_counts": {
        "cmdb": 1,
        "runtime": 1,
        "log": 6
      },
      "covered_services": [
        "cartservice",
        "checkoutservice",
        "currencyservice"
      ],
      "hits": [
        {
          "rank": 1,
          "score": 1.4007,
          "source": "/home/nghia/DACN/aiops_platform/cmdb/services.json",
          "source_type": "cmdb",
          "signal_type": "cmdb",
          "services": [
            "cartservice",
            "checkoutservice",
            "currencyservice"
          ],
          "time_hint": "n/a",
          "query_tag": "cmdb"
        },
        {
          "rank": 2,
          "score": 1.1746,
          "source": "runtime://default/deployment/checkoutservice",
          "source_type": "runtime",
          "signal_type": "runtime",
          "services": [
            "checkoutservice"
          ],
          "time_hint": "n/a",
          "query_tag": "runtime"
        },
        {
          "rank": 3,
          "score": 0.3867,